{
  "$schema": "https://json-schema.org/draft/2020-12/schema",
  "$defs": {
    "stage": {
      "type": "string",
      "enum": [
        "Advertised",
        "Candidate",
        "SessionCreated",
        "FirstFrameReceived",
        "Recorded",
        "FileVerified",
        "Sustained",
        "EmpiricallyVerified",
        "Failed",
        "Certified"
      ]
    },
    "evidence": {
      "type": "object",
      "required": [
        "stage",
        "status",
        "observedAt"
      ],
      "properties": {
        "stage": {
          "$ref": "#/$defs/stage"
        },
        "status": {
          "enum": [
            "pass",
            "fail",
            "stale",
            "notRun"
          ]
        },
        "observedAt": {
          "type": "string",
          "format": "date-time"
        },
        "source": {
          "type": "string"
        },
        "details": {
          "type": "object"
        }
      }
    },
    "knownValue": {
      "type": "object",
      "required": [
        "knowledge"
      ],
      "properties": {
        "knowledge": {
          "enum": [
            "unknown",
            "unsupported",
            "known"
          ]
        },
        "value": {},
        "unit": {
          "type": "string"
        }
      }
    }
  },
  "$id": "https://opencinecam.org/schema/capability-report.schema.json",
  "title": "Capability Report",
  "type": "object",
  "required": [
    "schemaVersion",
    "reportId",
    "createdAt",
    "device",
    "cameras",
    "codecs",
    "audio",
    "evidence"
  ],
  "properties": {
    "schemaVersion": {
      "const": "1.0.0"
    },
    "reportId": {
      "type": "string",
      "format": "uuid"
    },
    "createdAt": {
      "type": "string",
      "format": "date-time"
    },
    "device": {
      "type": "object",
      "required": [
        "buildFingerprint",
        "sdkInt",
        "characteristicsDigest"
      ]
    },
    "cameras": {
      "type": "array"
    },
    "codecs": {
      "type": "array"
    },
    "audio": {
      "type": "object"
    },
    "evidence": {
      "type": "array",
      "items": {
        "$ref": "#/$defs/evidence"
      }
    }
  },
  "additionalProperties": true
}
